{
  "$schema": "http://json-schema.org/draft-07/schema#",
  "title": "StudyTimetrialTheme",
  "description": "Contrato formal de validación para temas y paletas visuales de Study Timetrial.",
  "type": "object",
  "required": [
    "name",
    "is_dark",
    "bg_app",
    "bg_dialog",
    "bg_surface",
    "bg_card",
    "text_primary",
    "text_secondary",
    "text_muted",
    "border_subtle",
    "border_strong",
    "toolbar_primary_bg",
    "hero_start_bg"
  ],
  "properties": {
    "name": {
      "type": "string",
      "description": "Identificador único del tema (ej. light, dark, nord)"
    },
    "is_dark": {
      "type": "boolean",
      "description": "Indica si el tema es de luminancia oscura o clara"
    },
    "mode_comment": {
      "type": "string",
      "description": "Comentario informativo o descriptor del tema"
    },
    "effect": {
      "type": "string",
      "description": "Efecto de partículas dinámicas opcional (ej. sakura, snow, stars, bamboo, halloween, vampyr, none)"
    },
    "background_image": {
      "type": "string",
      "description": "Ruta o descriptor opcional de textura o imagen de fondo"
    },
    "bg_app": { "type": "string" },
    "bg_dialog": { "type": "string" },
    "bg_surface": { "type": "string" },
    "bg_surface_alt": { "type": "string" },
    "bg_card": { "type": "string" },
    "bg_card_inner": { "type": "string" },
    "bg_clock_card": { "type": "string" },
    "bg_tab_bar": { "type": "string" },
    "bg_tab_active": { "type": "string" },
    "bg_location_badge": { "type": "string" },
    "bg_status_badge": { "type": "string" },
    "bg_input": { "type": "string" },
    "bg_input_focus": { "type": "string" },
    "bg_input_disabled": { "type": "string" },
    "bg_button": { "type": "string" },
    "bg_button_hover": { "type": "string" },
    "bg_button_pressed": { "type": "string" },
    "bg_stepper_pressed": { "type": "string" },
    "bg_secondary_action": { "type": "string" },
    "bg_secondary_hover": { "type": "string" },
    "bg_table": { "type": "string" },
    "bg_table_alt": { "type": "string" },
    "bg_table_header": { "type": "string" },
    "table_gridline": { "type": "string" },
    "table_selection_bg": { "type": "string" },
    "table_selection_fg": { "type": "string" },
    "bg_list": { "type": "string" },
    "list_item_hover": { "type": "string" },
    "list_item_selected_bg": { "type": "string" },
    "list_item_selected_fg": { "type": "string" },
    "bg_filter_panel": { "type": "string" },
    "bg_combobox": { "type": "string" },
    "combobox_fg": { "type": "string" },
    "combobox_hover_bg": { "type": "string" },
    "combobox_focus_border": { "type": "string" },
    "combobox_dropdown_bg": { "type": "string" },
    "combobox_dropdown_fg": { "type": "string" },
    "combobox_dropdown_sel_bg": { "type": "string" },
    "combobox_dropdown_sel_fg": { "type": "string" },
    "filter_reset_bg": { "type": "string" },
    "filter_reset_fg": { "type": "string" },
    "filter_reset_hover_bg": { "type": "string" },
    "filter_reset_hover_fg": { "type": "string" },
    "filter_reset_hover_border": { "type": "string" },
    "sort_dir_btn_bg": { "type": "string" },
    "sort_dir_btn_fg": { "type": "string" },
    "sort_dir_btn_hover_bg": { "type": "string" },
    "sort_dir_btn_hover_border": { "type": "string" },
    "popup_bg": { "type": "string" },
    "popup_border": { "type": "string" },
    "popup_title_fg": { "type": "string" },
    "popup_btn_bg": { "type": "string" },
    "popup_btn_fg": { "type": "string" },
    "popup_btn_border": { "type": "string" },
    "popup_btn_hover_bg": { "type": "string" },
    "popup_btn_hover_border": { "type": "string" },
    "popup_btn_hover_fg": { "type": "string" },
    "popup_sep": { "type": "string" },
    "popup_list_bg": { "type": "string" },
    "popup_list_border": { "type": "string" },
    "popup_list_hover": { "type": "string" },
    "bg_toolbar": { "type": "string" },
    "toolbar_border": { "type": "string" },
    "toolbar_btn_bg": { "type": "string" },
    "toolbar_btn_fg": { "type": "string" },
    "toolbar_btn_border": { "type": "string" },
    "toolbar_btn_hover_bg": { "type": "string" },
    "toolbar_btn_hover_border": { "type": "string" },
    "toolbar_btn_hover_fg": { "type": "string" },
    "toolbar_btn_pressed": { "type": "string" },
    "toolbar_primary_bg": { "type": "string" },
    "toolbar_primary_fg": { "type": "string" },
    "toolbar_primary_border": { "type": "string" },
    "toolbar_primary_hover_bg": { "type": "string" },
    "toolbar_primary_hover_fg": { "type": "string" },
    "menu_bg": { "type": "string" },
    "menu_fg": { "type": "string" },
    "menu_border": { "type": "string" },
    "menu_item_fg": { "type": "string" },
    "menu_item_sel_bg": { "type": "string" },
    "menu_item_sel_fg": { "type": "string" },
    "menu_item_disabled": { "type": "string" },
    "menu_separator": { "type": "string" },
    "border_subtle": { "type": "string" },
    "border_strong": { "type": "string" },
    "border_focus": { "type": "string" },
    "border_disabled": { "type": "string" },
    "card_border": { "type": "string" },
    "hero_card_top": { "type": "string" },
    "text_primary": { "type": "string" },
    "text_heading": { "type": "string" },
    "text_secondary": { "type": "string" },
    "text_muted": { "type": "string" },
    "text_faint": { "type": "string" },
    "text_disabled": { "type": "string" },
    "text_checkbox": { "type": "string" },
    "text_clock_exercise": { "type": "string" },
    "text_clock_break": { "type": "string" },
    "tab_text": { "type": "string" },
    "tab_text_selected": { "type": "string" },
    "hero_start_bg": { "type": "string" },
    "hero_start_fg": { "type": "string" },
    "hero_start_border": { "type": "string" },
    "hero_start_hover_bg": { "type": "string" },
    "hero_start_hover_border": { "type": "string" },
    "hero_start_hover_fg": { "type": "string" },
    "hero_pause_bg": { "type": "string" },
    "hero_pause_fg": { "type": "string" },
    "hero_pause_border": { "type": "string" },
    "hero_pause_hover_bg": { "type": "string" },
    "hero_pause_hover_border": { "type": "string" },
    "hero_resume_bg": { "type": "string" },
    "hero_resume_fg": { "type": "string" },
    "hero_resume_border": { "type": "string" },
    "hero_resume_hover_bg": { "type": "string" },
    "hero_resume_hover_border": { "type": "string" },
    "stop_bg": { "type": "string" },
    "stop_fg": { "type": "string" },
    "stop_border": { "type": "string" },
    "stop_hover_bg": { "type": "string" },
    "stop_hover_border": { "type": "string" },
    "complete_bg": { "type": "string" },
    "complete_fg": { "type": "string" },
    "complete_border": { "type": "string" },
    "complete_hover_bg": { "type": "string" },
    "danger_bg": { "type": "string" },
    "danger_fg": { "type": "string" },
    "danger_border": { "type": "string" },
    "danger_hover_bg": { "type": "string" },
    "comment_action_bg": { "type": "string" },
    "comment_action_fg": { "type": "string" },
    "comment_action_border": { "type": "string" },
    "comment_action_hover_bg": { "type": "string" },
    "comment_action_hover_border": { "type": "string" },
    "comment_action_hover_fg": { "type": "string" },
    "badge_completed_bg": { "type": "string" },
    "badge_completed_fg": { "type": "string" },
    "badge_completed_border": { "type": "string" },
    "badge_incomplete_bg": { "type": "string" },
    "badge_incomplete_fg": { "type": "string" },
    "badge_incomplete_border": { "type": "string" },
    "progress_bg": { "type": "string" },
    "progress_border": { "type": "string" },
    "progress_fg": { "type": "string" },
    "progress_chunk": { "type": "string" },
    "scroll_bg": { "type": "string" },
    "scroll_handle": { "type": "string" },
    "scroll_handle_hover": { "type": "string" },
    "tooltip_bg": { "type": "string" },
    "tooltip_fg": { "type": "string" },
    "tooltip_border": { "type": "string" },
    "color_absence": { "type": "string" },
    "color_absence_border": { "type": "string" },
    "color_future": { "type": "string" },
    "color_future_border": { "type": "string" },
    "bg_chart": { "type": "string" },
    "chart_gridline": { "type": "string" },
    "chart_time_curve": { "type": "string" },
    "chart_time_area": { "type": "string" },
    "activity_bar_bg": { "type": "string" },
    "activity_bar_fill": { "type": "string" },
    "activity_bar_peak": { "type": "string" },
    "activity_needle": { "type": "string" },
    "tab_icon_active": { "type": "string" },
    "tab_icon_inactive": { "type": "string" },
    "clock_card_active_exercise_bg": { "type": "string" },
    "clock_card_active_exercise_border": { "type": "string" },
    "clock_card_active_break_bg": { "type": "string" },
    "clock_card_active_break_border": { "type": "string" },
    "clock_card_paused_border": { "type": "string" }
  },
  "additionalProperties": true
}
