{
  "$schema": "./theme.schema.json",
  "name": "sakura",
  "is_dark": false,
  "effect": "sakura",
  "mode_comment": "/* --- TEMA SAKURA [DINÁMICO] (PAPEL WASHI & PÉTALOS DE CEREZO) --- */",
  "bg_app": "#f8f1f3",
  "bg_dialog": "#fcf7f8",
  "bg_surface": "#fcf7f8",
  "bg_surface_alt": "#f3e6e9",
  "bg_card": "#fcf7f8",
  "bg_card_inner": "#f3e6e9",
  "bg_clock_card": "#fcf7f8",
  "bg_tab_bar": "#ece0e3",
  "bg_tab_active": "#fcf7f8",
  "bg_location_badge": "#f3e6e9",
  "bg_status_badge": "#ece0e3",
  "bg_input": "#fcf7f8",
  "bg_input_focus": "#ffffff",
  "bg_input_disabled": "#ece0e3",
  "bg_button": "#fcf7f8",
  "bg_button_hover": "#f3e6e9",
  "bg_button_pressed": "#e6d0d5",
  "bg_stepper_pressed": "#e6d0d5",
  "bg_secondary_action": "#fcf7f8",
  "bg_secondary_hover": "#f3e6e9",
  "bg_table": "#fcf7f8",
  "bg_table_alt": "#f8f0f2",
  "bg_table_header": "#ece0e3",
  "table_gridline": "#edd5dc",
  "table_selection_bg": "#f9e2e8",
  "table_selection_fg": "#4a0e2e",
  "bg_list": "#fcf7f8",
  "list_item_hover": "#f3e6e9",
  "list_item_selected_bg": "#f9e2e8",
  "list_item_selected_fg": "#be185d",
  "bg_filter_panel": "#f8f1f3",
  "bg_combobox": "#fcf7f8",
  "combobox_fg": "#4a0e2e",
  "combobox_hover_bg": "#f3e6e9",
  "combobox_focus_border": "#ec4899",
  "combobox_dropdown_bg": "#fcf7f8",
  "combobox_dropdown_fg": "#4a0e2e",
  "combobox_dropdown_sel_bg": "#f9e2e8",
  "combobox_dropdown_sel_fg": "#be185d",
  "filter_reset_bg": "#ece0e3",
  "filter_reset_fg": "#831843",
  "filter_reset_hover_bg": "#e6d0d5",
  "filter_reset_hover_fg": "#4a0e2e",
  "filter_reset_hover_border": "#ec4899",
  "sort_dir_btn_bg": "#ece0e3",
  "sort_dir_btn_fg": "#be185d",
  "sort_dir_btn_hover_bg": "#e6d0d5",
  "sort_dir_btn_hover_border": "#ec4899",
  "popup_bg": "#fcf7f8",
  "popup_border": "#edd5dc",
  "popup_title_fg": "#831843",
  "popup_btn_bg": "#f8f1f3",
  "popup_btn_fg": "#831843",
  "popup_btn_border": "#edd5dc",
  "popup_btn_hover_bg": "#ece0e3",
  "popup_btn_hover_border": "#ec4899",
  "popup_btn_hover_fg": "#4a0e2e",
  "popup_sep": "#edd5dc",
  "popup_list_bg": "#fcf7f8",
  "popup_list_border": "#edd5dc",
  "popup_list_hover": "#f3e6e9",
  "bg_toolbar": "#fcf7f8",
  "toolbar_border": "#edd5dc",
  "toolbar_btn_bg": "#fcf7f8",
  "toolbar_btn_fg": "#4a0e2e",
  "toolbar_btn_border": "#edd5dc",
  "toolbar_btn_hover_bg": "#f3e6e9",
  "toolbar_btn_hover_border": "#ec4899",
  "toolbar_btn_hover_fg": "#4a0e2e",
  "toolbar_btn_pressed": "#e6d0d5",
  "toolbar_primary_bg": "#db2777",
  "toolbar_primary_fg": "#ffffff",
  "toolbar_primary_border": "#be185d",
  "toolbar_primary_hover_bg": "#be185d",
  "toolbar_primary_hover_fg": "#ffffff",
  "menu_bg": "#fcf7f8",
  "menu_fg": "#4a0e2e",
  "menu_border": "#edd5dc",
  "menu_item_fg": "#4a0e2e",
  "menu_item_sel_bg": "#f9e2e8",
  "menu_item_sel_fg": "#be185d",
  "menu_item_disabled": "#a88fa0",
  "menu_separator": "#edd5dc",
  "border_subtle": "#edd5dc",
  "border_strong": "#dfb6c3",
  "border_focus": "#db2777",
  "border_disabled": "#edd5dc",
  "card_border": "#edd5dc",
  "hero_card_top": "#db2777",
  "text_primary": "#4a0e2e",
  "text_heading": "#370b22",
  "text_secondary": "#6f1e46",
  "text_muted": "#934d70",
  "text_faint": "#a88fa0",
  "text_disabled": "#a88fa0",
  "text_checkbox": "#4a0e2e",
  "text_clock_exercise": "#4a0e2e",
  "text_clock_break": "#934d70",
  "tab_text": "#934d70",
  "tab_text_selected": "#be185d",
  "hero_start_bg": "#db2777",
  "hero_start_fg": "#ffffff",
  "hero_start_border": "#be185d",
  "hero_start_hover_bg": "#be185d",
  "hero_start_hover_border": "#9d174d",
  "hero_start_hover_fg": "#ffffff",
  "hero_pause_bg": "#fef3c7",
  "hero_pause_fg": "#b45309",
  "hero_pause_border": "#fde68a",
  "hero_pause_hover_bg": "#fde68a",
  "hero_pause_hover_border": "#d97706",
  "hero_resume_bg": "#fce7f3",
  "hero_resume_fg": "#be185d",
  "hero_resume_border": "#fbcfe8",
  "hero_resume_hover_bg": "#fbcfe8",
  "hero_resume_hover_border": "#db2777",
  "stop_bg": "#ffe4e6",
  "stop_fg": "#e11d48",
  "stop_border": "#fecdd3",
  "stop_hover_bg": "#fecdd3",
  "stop_hover_border": "#be123c",
  "complete_bg": "#059669",
  "complete_fg": "#ffffff",
  "complete_border": "#047857",
  "complete_hover_bg": "#047857",
  "danger_bg": "#ffe4e6",
  "danger_fg": "#e11d48",
  "danger_border": "#fecdd3",
  "danger_hover_bg": "#fecdd3",
  "comment_action_bg": "#fcf7f8",
  "comment_action_fg": "#6f1e46",
  "comment_action_border": "#edd5dc",
  "comment_action_hover_bg": "#f3e6e9",
  "comment_action_hover_border": "#db2777",
  "comment_action_hover_fg": "#4a0e2e",
  "badge_completed_bg": "#d1fae5",
  "badge_completed_fg": "#047857",
  "badge_completed_border": "#a7f3d0",
  "badge_incomplete_bg": "#ffe4e6",
  "badge_incomplete_fg": "#be123c",
  "badge_incomplete_border": "#fecdd3",
  "progress_bg": "#ece0e3",
  "progress_border": "#edd5dc",
  "progress_fg": "#4a0e2e",
  "progress_chunk": "#db2777",
  "scroll_bg": "#f8f1f3",
  "scroll_handle": "#dfb6c3",
  "scroll_handle_hover": "#db2777",
  "tooltip_bg": "#4a0e2e",
  "tooltip_fg": "#fcf7f8",
  "tooltip_border": "#831843",
  "color_absence": "#f3e6e9",
  "color_absence_border": "#edd5dc",
  "color_future": "#f8f1f3",
  "color_future_border": "#dfb6c3",
  "bg_chart": "#fcf7f8",
  "chart_gridline": "#edd5dc",
  "chart_time_curve": "#db2777",
  "chart_time_area": "rgba(219, 39, 119, 0.15)",
  "activity_bar_bg": "#f3e6e9",
  "activity_bar_fill": "#ec4899",
  "activity_bar_peak": "#be185d",
  "activity_needle": "#be185d",
  "tab_icon_active": "#be185d",
  "tab_icon_inactive": "#934d70",
  "clock_card_active_exercise_bg": "#fdf2f4",
  "clock_card_active_exercise_border": "#db2777",
  "clock_card_active_break_bg": "#fef3c7",
  "clock_card_active_break_border": "#f59e0b",
  "clock_card_paused_border": "#dfb6c3"
}