{
  "$schema": "./theme.schema.json",
  "name": "marsala",
  "is_dark": true,
  "mode_comment": "/* --- TEMA MARSALA (PANTONE 18-1438 & BORGOÑA VINTAGE) --- */",
  "bg_app": "#140a0e",
  "bg_dialog": "#231218",
  "bg_surface": "#1c0e14",
  "bg_surface_alt": "#2a151d",
  "bg_card": "#1c0e14",
  "bg_card_inner": "#2c1720",
  "bg_clock_card": "#2c1720",
  "bg_tab_bar": "#0c0608",
  "bg_tab_active": "#1c0e14",
  "bg_location_badge": "#2a151d",
  "bg_status_badge": "#231218",
  "bg_input": "#140a0e",
  "bg_input_focus": "#2c1720",
  "bg_input_disabled": "#1c0e14",
  "bg_button": "#231218",
  "bg_button_hover": "#331a23",
  "bg_button_pressed": "#180c11",
  "bg_stepper_pressed": "#2c1720",
  "bg_secondary_action": "#231218",
  "bg_secondary_hover": "#331a23",
  "bg_table": "#170b10",
  "bg_table_alt": "#1c0e14",
  "bg_table_header": "#0c0608",
  "table_gridline": "#361b25",
  "table_selection_bg": "#3b1d28",
  "table_selection_fg": "#fdf4f5",
  "bg_list": "#140a0e",
  "list_item_hover": "#2a151d",
  "list_item_selected_bg": "#3b1d28",
  "list_item_selected_fg": "#f472b6",
  "bg_filter_panel": "#12080c",
  "bg_combobox": "#1c0e14",
  "combobox_fg": "#fdf4f5",
  "combobox_hover_bg": "#331a23",
  "combobox_focus_border": "#955251",
  "combobox_dropdown_bg": "#170b10",
  "combobox_dropdown_fg": "#fdf4f5",
  "combobox_dropdown_sel_bg": "#3b1d28",
  "combobox_dropdown_sel_fg": "#fbcfe8",
  "filter_reset_bg": "#231218",
  "filter_reset_fg": "#e2b4be",
  "filter_reset_hover_bg": "#331a23",
  "filter_reset_hover_fg": "#ffffff",
  "filter_reset_hover_border": "#e09f87",
  "sort_dir_btn_bg": "#231218",
  "sort_dir_btn_fg": "#f472b6",
  "sort_dir_btn_hover_bg": "#331a23",
  "sort_dir_btn_hover_border": "#e09f87",
  "popup_bg": "#170b10",
  "popup_border": "#42212d",
  "popup_title_fg": "#f472b6",
  "popup_btn_bg": "#1c0e14",
  "popup_btn_fg": "#fdf4f5",
  "popup_btn_border": "#42212d",
  "popup_btn_hover_bg": "#331a23",
  "popup_btn_hover_border": "#e09f87",
  "popup_btn_hover_fg": "#ffffff",
  "popup_sep": "#361b25",
  "popup_list_bg": "#140a0e",
  "popup_list_border": "#361b25",
  "popup_list_hover": "#2a151d",
  "bg_toolbar": "#12080c",
  "toolbar_border": "#361b25",
  "toolbar_btn_bg": "#231218",
  "toolbar_btn_fg": "#fdf4f5",
  "toolbar_btn_border": "#42212d",
  "toolbar_btn_hover_bg": "#331a23",
  "toolbar_btn_hover_border": "#e09f87",
  "toolbar_btn_hover_fg": "#ffffff",
  "toolbar_btn_pressed": "#180c11",
  "toolbar_primary_bg": "#955251",
  "toolbar_primary_fg": "#ffffff",
  "toolbar_primary_border": "#b06564",
  "toolbar_primary_hover_bg": "#7d4342",
  "toolbar_primary_hover_fg": "#ffffff",
  "menu_bg": "#170b10",
  "menu_fg": "#fdf4f5",
  "menu_border": "#42212d",
  "menu_item_fg": "#fdf4f5",
  "menu_item_sel_bg": "#3b1d28",
  "menu_item_sel_fg": "#fbcfe8",
  "menu_item_disabled": "#5e3843",
  "menu_separator": "#361b25",
  "border_subtle": "#361b25",
  "border_strong": "#522938",
  "border_focus": "#e09f87",
  "border_disabled": "#27141b",
  "card_border": "#361b25",
  "hero_card_top": "#955251",
  "text_primary": "#fdf4f5",
  "text_heading": "#ffffff",
  "text_secondary": "#e2b4be",
  "text_muted": "#b3838e",
  "text_faint": "#784d57",
  "text_disabled": "#5e3843",
  "text_checkbox": "#fdf4f5",
  "text_clock_exercise": "#fdf4f5",
  "text_clock_break": "#b3838e",
  "tab_text": "#b3838e",
  "tab_text_selected": "#f472b6",
  "hero_start_bg": "#955251",
  "hero_start_fg": "#ffffff",
  "hero_start_border": "#b06564",
  "hero_start_hover_bg": "#7d4342",
  "hero_start_hover_border": "#e09f87",
  "hero_start_hover_fg": "#ffffff",
  "hero_pause_bg": "#451a03",
  "hero_pause_fg": "#fde68a",
  "hero_pause_border": "#78350f",
  "hero_pause_hover_bg": "#78350f",
  "hero_pause_hover_border": "#b45309",
  "hero_resume_bg": "#4a1d26",
  "hero_resume_fg": "#fbcfe8",
  "hero_resume_border": "#831843",
  "hero_resume_hover_bg": "#5c2430",
  "hero_resume_hover_border": "#db2777",
  "stop_bg": "#450a0a",
  "stop_fg": "#fca5a5",
  "stop_border": "#7f1d1d",
  "stop_hover_bg": "#7f1d1d",
  "stop_hover_border": "#991b1b",
  "complete_bg": "#065f46",
  "complete_fg": "#a7f3d0",
  "complete_border": "#059669",
  "complete_hover_bg": "#047857",
  "danger_bg": "#450a0a",
  "danger_fg": "#fca5a5",
  "danger_border": "#7f1d1d",
  "danger_hover_bg": "#5c1010",
  "comment_action_bg": "#231218",
  "comment_action_fg": "#fdf4f5",
  "comment_action_border": "#42212d",
  "comment_action_hover_bg": "#331a23",
  "comment_action_hover_border": "#e09f87",
  "comment_action_hover_fg": "#ffffff",
  "badge_completed_bg": "#064e3b",
  "badge_completed_fg": "#6ee7b7",
  "badge_completed_border": "#059669",
  "badge_incomplete_bg": "#450a0a",
  "badge_incomplete_fg": "#fca5a5",
  "badge_incomplete_border": "#7f1d1d",
  "progress_bg": "#1c0e14",
  "progress_border": "#361b25",
  "progress_fg": "#fdf4f5",
  "progress_chunk": "#955251",
  "scroll_bg": "#140a0e",
  "scroll_handle": "#42212d",
  "scroll_handle_hover": "#955251",
  "tooltip_bg": "#231218",
  "tooltip_fg": "#fdf4f5",
  "tooltip_border": "#e09f87",
  "color_absence": "#221217",
  "color_absence_border": "#3d1f27",
  "color_future": "#130a0d",
  "color_future_border": "#3d1f27",
  "bg_chart": "#140a0e",
  "chart_gridline": "#2b161c",
  "chart_time_curve": "#be123c",
  "chart_time_area": "rgba(190, 18, 60, 0.18)",
  "activity_bar_bg": "#221217",
  "activity_bar_fill": "#be123c",
  "activity_bar_peak": "#e11d48",
  "activity_needle": "#e11d48",
  "tab_icon_active": "#e11d48",
  "tab_icon_inactive": "#8f636e",
  "clock_card_active_exercise_bg": "#260a12",
  "clock_card_active_exercise_border": "#be123c",
  "clock_card_active_break_bg": "#281404",
  "clock_card_active_break_border": "#f59e0b",
  "clock_card_paused_border": "#5a2e3a"
}