{
  "$schema": "./theme.schema.json",
  "name": "black_sakura",
  "is_dark": true,
  "effect": "sakura",
  "mode_comment": "/* --- TEMA BLACK SAKURA [DINÁMICO] (CEREZO NOCTURNO & CARMÍN) --- */",
  "bg_app": "#0c0a0e",
  "bg_dialog": "#17121b",
  "bg_surface": "#141018",
  "bg_surface_alt": "#1c1622",
  "bg_card": "#141018",
  "bg_card_inner": "#1e1725",
  "bg_clock_card": "#1e1725",
  "bg_tab_bar": "#08060a",
  "bg_tab_active": "#141018",
  "bg_location_badge": "#1c1622",
  "bg_status_badge": "#17121b",
  "bg_input": "#0c0a0e",
  "bg_input_focus": "#1e1725",
  "bg_input_disabled": "#141018",
  "bg_button": "#1a1320",
  "bg_button_hover": "#251b2e",
  "bg_button_pressed": "#120d17",
  "bg_stepper_pressed": "#1e1725",
  "bg_secondary_action": "#1a1320",
  "bg_secondary_hover": "#251b2e",
  "bg_table": "#0e0b11",
  "bg_table_alt": "#141018",
  "bg_table_header": "#08060a",
  "table_gridline": "#251929",
  "table_selection_bg": "#2d1a33",
  "table_selection_fg": "#fce7f3",
  "bg_list": "#0c0a0e",
  "list_item_hover": "#1c1622",
  "list_item_selected_bg": "#2d1a33",
  "list_item_selected_fg": "#f472b6",
  "bg_filter_panel": "#0e0b11",
  "bg_combobox": "#141018",
  "combobox_fg": "#fce7f3",
  "combobox_hover_bg": "#1e1725",
  "combobox_focus_border": "#e11d48",
  "combobox_dropdown_bg": "#0e0b11",
  "combobox_dropdown_fg": "#fdf2f8",
  "combobox_dropdown_sel_bg": "#2d1a33",
  "combobox_dropdown_sel_fg": "#f472b6",
  "filter_reset_bg": "#1a1320",
  "filter_reset_fg": "#f472b6",
  "filter_reset_hover_bg": "#251b2e",
  "filter_reset_hover_fg": "#ffffff",
  "filter_reset_hover_border": "#e11d48",
  "sort_dir_btn_bg": "#1a1320",
  "sort_dir_btn_fg": "#f472b6",
  "sort_dir_btn_hover_bg": "#251b2e",
  "sort_dir_btn_hover_border": "#e11d48",
  "popup_bg": "#0e0b11",
  "popup_border": "#3b1e3e",
  "popup_title_fg": "#f472b6",
  "popup_btn_bg": "#141018",
  "popup_btn_fg": "#fce7f3",
  "popup_btn_border": "#3b1e3e",
  "popup_btn_hover_bg": "#1e1725",
  "popup_btn_hover_border": "#e11d48",
  "popup_btn_hover_fg": "#ffffff",
  "popup_sep": "#251929",
  "popup_list_bg": "#0c0a0e",
  "popup_list_border": "#251929",
  "popup_list_hover": "#1c1622",
  "bg_toolbar": "#0e0b11",
  "toolbar_border": "#251929",
  "toolbar_btn_bg": "#1a1320",
  "toolbar_btn_fg": "#fce7f3",
  "toolbar_btn_border": "#3b1e3e",
  "toolbar_btn_hover_bg": "#251b2e",
  "toolbar_btn_hover_border": "#e11d48",
  "toolbar_btn_hover_fg": "#ffffff",
  "toolbar_btn_pressed": "#120d17",
  "toolbar_primary_bg": "#be123c",
  "toolbar_primary_fg": "#ffffff",
  "toolbar_primary_border": "#9f1239",
  "toolbar_primary_hover_bg": "#9f1239",
  "toolbar_primary_hover_fg": "#ffffff",
  "menu_bg": "#0e0b11",
  "menu_fg": "#fce7f3",
  "menu_border": "#3b1e3e",
  "menu_item_fg": "#fce7f3",
  "menu_item_sel_bg": "#2d1a33",
  "menu_item_sel_fg": "#f472b6",
  "menu_item_disabled": "#5c3d52",
  "menu_separator": "#251929",
  "border_subtle": "#251929",
  "border_strong": "#422046",
  "border_focus": "#e11d48",
  "border_disabled": "#170f1a",
  "card_border": "#251929",
  "hero_card_top": "#e11d48",
  "text_primary": "#fce7f3",
  "text_heading": "#ffffff",
  "text_secondary": "#fbcfe8",
  "text_muted": "#f472b6",
  "text_faint": "#7a4666",
  "text_disabled": "#5c3d52",
  "text_checkbox": "#fce7f3",
  "text_clock_exercise": "#fce7f3",
  "text_clock_break": "#f472b6",
  "tab_text": "#f472b6",
  "tab_text_selected": "#fb7185",
  "hero_start_bg": "#be123c",
  "hero_start_fg": "#ffffff",
  "hero_start_border": "#e11d48",
  "hero_start_hover_bg": "#9f1239",
  "hero_start_hover_border": "#be123c",
  "hero_start_hover_fg": "#ffffff",
  "hero_pause_bg": "#451a03",
  "hero_pause_fg": "#fde68a",
  "hero_pause_border": "#78350f",
  "hero_pause_hover_bg": "#78350f",
  "hero_pause_hover_border": "#b45309",
  "hero_resume_bg": "#4c0519",
  "hero_resume_fg": "#fecdd3",
  "hero_resume_border": "#be123c",
  "hero_resume_hover_bg": "#881337",
  "hero_resume_hover_border": "#e11d48",
  "stop_bg": "#450a0a",
  "stop_fg": "#fca5a5",
  "stop_border": "#7f1d1d",
  "stop_hover_bg": "#7f1d1d",
  "stop_hover_border": "#991b1b",
  "complete_bg": "#065f46",
  "complete_fg": "#a7f3d0",
  "complete_border": "#059669",
  "complete_hover_bg": "#047857",
  "danger_bg": "#450a0a",
  "danger_fg": "#fca5a5",
  "danger_border": "#7f1d1d",
  "danger_hover_bg": "#5c1010",
  "comment_action_bg": "#1a1320",
  "comment_action_fg": "#fce7f3",
  "comment_action_border": "#3b1e3e",
  "comment_action_hover_bg": "#251b2e",
  "comment_action_hover_border": "#e11d48",
  "comment_action_hover_fg": "#ffffff",
  "badge_completed_bg": "#132b21",
  "badge_completed_fg": "#34d399",
  "badge_completed_border": "#059669",
  "badge_incomplete_bg": "#450a0a",
  "badge_incomplete_fg": "#fca5a5",
  "badge_incomplete_border": "#7f1d1d",
  "progress_bg": "#141018",
  "progress_border": "#251929",
  "progress_fg": "#fce7f3",
  "progress_chunk": "#e11d48",
  "scroll_bg": "#0c0a0e",
  "scroll_handle": "#3b1e3e",
  "scroll_handle_hover": "#e11d48",
  "tooltip_bg": "#1a1320",
  "tooltip_fg": "#fce7f3",
  "tooltip_border": "#e11d48",
  "color_absence": "#1c151e",
  "color_absence_border": "#38263c",
  "color_future": "#0d090e",
  "color_future_border": "#38263c",
  "bg_chart": "#0f0b10",
  "chart_gridline": "#261a29",
  "chart_time_curve": "#d946ef",
  "chart_time_area": "rgba(217, 70, 239, 0.18)",
  "activity_bar_bg": "#1c151e",
  "activity_bar_fill": "#c026d3",
  "activity_bar_peak": "#e879f9",
  "activity_needle": "#e879f9",
  "tab_icon_active": "#e879f9",
  "tab_icon_inactive": "#8a6a92",
  "clock_card_active_exercise_bg": "#250c29",
  "clock_card_active_exercise_border": "#d946ef",
  "clock_card_active_break_bg": "#261405",
  "clock_card_active_break_border": "#f59e0b",
  "clock_card_paused_border": "#593b60"
}