{
  "$schema": "./theme.schema.json",
  "name": "illuminating",
  "is_dark": true,
  "mode_comment": "/* --- TEMA ILLUMINATING (PANTONE 17-5104 + 13-0647 & GRAFITO SOLAR) --- */",
  "bg_app": "#131518",
  "bg_dialog": "#20232a",
  "bg_surface": "#1a1d22",
  "bg_surface_alt": "#242830",
  "bg_card": "#1a1d22",
  "bg_card_inner": "#252932",
  "bg_clock_card": "#252932",
  "bg_tab_bar": "#0c0e10",
  "bg_tab_active": "#1a1d22",
  "bg_location_badge": "#242830",
  "bg_status_badge": "#20232a",
  "bg_input": "#131518",
  "bg_input_focus": "#252932",
  "bg_input_disabled": "#1a1d22",
  "bg_button": "#20232a",
  "bg_button_hover": "#2b303a",
  "bg_button_pressed": "#181a1f",
  "bg_stepper_pressed": "#252932",
  "bg_secondary_action": "#20232a",
  "bg_secondary_hover": "#2b303a",
  "bg_table": "#16191e",
  "bg_table_alt": "#1a1d22",
  "bg_table_header": "#0c0e10",
  "table_gridline": "#2b303a",
  "table_selection_bg": "#333946",
  "table_selection_fg": "#f8fafc",
  "bg_list": "#131518",
  "list_item_hover": "#242830",
  "list_item_selected_bg": "#333946",
  "list_item_selected_fg": "#f5df4d",
  "bg_filter_panel": "#101215",
  "bg_combobox": "#1a1d22",
  "combobox_fg": "#f8fafc",
  "combobox_hover_bg": "#2b303a",
  "combobox_focus_border": "#f5df4d",
  "combobox_dropdown_bg": "#16191e",
  "combobox_dropdown_fg": "#f8fafc",
  "combobox_dropdown_sel_bg": "#333946",
  "combobox_dropdown_sel_fg": "#f5df4d",
  "filter_reset_bg": "#20232a",
  "filter_reset_fg": "#cbd5e1",
  "filter_reset_hover_bg": "#2b303a",
  "filter_reset_hover_fg": "#ffffff",
  "filter_reset_hover_border": "#f5df4d",
  "sort_dir_btn_bg": "#20232a",
  "sort_dir_btn_fg": "#f5df4d",
  "sort_dir_btn_hover_bg": "#2b303a",
  "sort_dir_btn_hover_border": "#f5df4d",
  "popup_bg": "#16191e",
  "popup_border": "#3a414f",
  "popup_title_fg": "#f5df4d",
  "popup_btn_bg": "#1a1d22",
  "popup_btn_fg": "#f8fafc",
  "popup_btn_border": "#3a414f",
  "popup_btn_hover_bg": "#2b303a",
  "popup_btn_hover_border": "#f5df4d",
  "popup_btn_hover_fg": "#ffffff",
  "popup_sep": "#2b303a",
  "popup_list_bg": "#131518",
  "popup_list_border": "#2b303a",
  "popup_list_hover": "#242830",
  "bg_toolbar": "#101215",
  "toolbar_border": "#2b303a",
  "toolbar_btn_bg": "#20232a",
  "toolbar_btn_fg": "#f8fafc",
  "toolbar_btn_border": "#3a414f",
  "toolbar_btn_hover_bg": "#2b303a",
  "toolbar_btn_hover_border": "#f5df4d",
  "toolbar_btn_hover_fg": "#ffffff",
  "toolbar_btn_pressed": "#181a1f",
  "toolbar_primary_bg": "#d97706",
  "toolbar_primary_fg": "#ffffff",
  "toolbar_primary_border": "#b45309",
  "toolbar_primary_hover_bg": "#b45309",
  "toolbar_primary_hover_fg": "#ffffff",
  "menu_bg": "#16191e",
  "menu_fg": "#f8fafc",
  "menu_border": "#3a414f",
  "menu_item_fg": "#f8fafc",
  "menu_item_sel_bg": "#333946",
  "menu_item_sel_fg": "#f5df4d",
  "menu_item_disabled": "#64748b",
  "menu_separator": "#2b303a",
  "border_subtle": "#2b303a",
  "border_strong": "#424a59",
  "border_focus": "#f5df4d",
  "border_disabled": "#1c2026",
  "card_border": "#2b303a",
  "hero_card_top": "#f5df4d",
  "text_primary": "#f8fafc",
  "text_heading": "#ffffff",
  "text_secondary": "#cbd5e1",
  "text_muted": "#94a3b8",
  "text_faint": "#64748b",
  "text_disabled": "#475569",
  "text_checkbox": "#f8fafc",
  "text_clock_exercise": "#f8fafc",
  "text_clock_break": "#f5df4d",
  "tab_text": "#94a3b8",
  "tab_text_selected": "#f5df4d",
  "hero_start_bg": "#d97706",
  "hero_start_fg": "#ffffff",
  "hero_start_border": "#f59e0b",
  "hero_start_hover_bg": "#b45309",
  "hero_start_hover_border": "#f5df4d",
  "hero_start_hover_fg": "#ffffff",
  "hero_pause_bg": "#451a03",
  "hero_pause_fg": "#fde68a",
  "hero_pause_border": "#78350f",
  "hero_pause_hover_bg": "#78350f",
  "hero_pause_hover_border": "#b45309",
  "hero_resume_bg": "#292524",
  "hero_resume_fg": "#fde68a",
  "hero_resume_border": "#78350f",
  "hero_resume_hover_bg": "#44403c",
  "hero_resume_hover_border": "#f5df4d",
  "stop_bg": "#450a0a",
  "stop_fg": "#fca5a5",
  "stop_border": "#7f1d1d",
  "stop_hover_bg": "#7f1d1d",
  "stop_hover_border": "#991b1b",
  "complete_bg": "#065f46",
  "complete_fg": "#a7f3d0",
  "complete_border": "#059669",
  "complete_hover_bg": "#047857",
  "danger_bg": "#450a0a",
  "danger_fg": "#fca5a5",
  "danger_border": "#7f1d1d",
  "danger_hover_bg": "#5c1010",
  "comment_action_bg": "#20232a",
  "comment_action_fg": "#f8fafc",
  "comment_action_border": "#3a414f",
  "comment_action_hover_bg": "#2b303a",
  "comment_action_hover_border": "#f5df4d",
  "comment_action_hover_fg": "#ffffff",
  "badge_completed_bg": "#064e3b",
  "badge_completed_fg": "#6ee7b7",
  "badge_completed_border": "#059669",
  "badge_incomplete_bg": "#450a0a",
  "badge_incomplete_fg": "#fca5a5",
  "badge_incomplete_border": "#7f1d1d",
  "progress_bg": "#1a1d22",
  "progress_border": "#2b303a",
  "progress_fg": "#f8fafc",
  "progress_chunk": "#f5df4d",
  "scroll_bg": "#131518",
  "scroll_handle": "#3a414f",
  "scroll_handle_hover": "#f5df4d",
  "tooltip_bg": "#20232a",
  "tooltip_fg": "#f8fafc",
  "tooltip_border": "#f5df4d",
  "color_absence": "#22252a",
  "color_absence_border": "#3a3f47",
  "color_future": "#131518",
  "color_future_border": "#3a3f47",
  "bg_chart": "#14161a",
  "chart_gridline": "#292d33",
  "chart_time_curve": "#eab308",
  "chart_time_area": "rgba(234, 179, 8, 0.18)",
  "activity_bar_bg": "#22252a",
  "activity_bar_fill": "#ca8a04",
  "activity_bar_peak": "#eab308",
  "activity_needle": "#eab308",
  "tab_icon_active": "#eab308",
  "tab_icon_inactive": "#858992",
  "clock_card_active_exercise_bg": "#282305",
  "clock_card_active_exercise_border": "#eab308",
  "clock_card_active_break_bg": "#261505",
  "clock_card_active_break_border": "#f97316",
  "clock_card_paused_border": "#555b66"
}