{
  "$schema": "./theme.schema.json",
  "name": "emerald",
  "is_dark": true,
  "mode_comment": "/* --- TEMA EMERALD (PANTONE 17-5641 & ESMERALDA JOYA) --- */",
  "bg_app": "#040e0a",
  "bg_dialog": "#0a1e16",
  "bg_surface": "#071711",
  "bg_surface_alt": "#0e261d",
  "bg_card": "#071711",
  "bg_card_inner": "#112d22",
  "bg_clock_card": "#112d22",
  "bg_tab_bar": "#020705",
  "bg_tab_active": "#071711",
  "bg_location_badge": "#0e261d",
  "bg_status_badge": "#0a1e16",
  "bg_input": "#040e0a",
  "bg_input_focus": "#112d22",
  "bg_input_disabled": "#071711",
  "bg_button": "#0a1e16",
  "bg_button_hover": "#123326",
  "bg_button_pressed": "#07150f",
  "bg_stepper_pressed": "#112d22",
  "bg_secondary_action": "#0a1e16",
  "bg_secondary_hover": "#123326",
  "bg_table": "#05130d",
  "bg_table_alt": "#071711",
  "bg_table_header": "#020705",
  "table_gridline": "#13382a",
  "table_selection_bg": "#174332",
  "table_selection_fg": "#ecfdf5",
  "bg_list": "#040e0a",
  "list_item_hover": "#0e261d",
  "list_item_selected_bg": "#174332",
  "list_item_selected_fg": "#34d399",
  "bg_filter_panel": "#030a07",
  "bg_combobox": "#071711",
  "combobox_fg": "#ecfdf5",
  "combobox_hover_bg": "#123326",
  "combobox_focus_border": "#009473",
  "combobox_dropdown_bg": "#05130d",
  "combobox_dropdown_fg": "#ecfdf5",
  "combobox_dropdown_sel_bg": "#174332",
  "combobox_dropdown_sel_fg": "#6ee7b7",
  "filter_reset_bg": "#0a1e16",
  "filter_reset_fg": "#a7f3d0",
  "filter_reset_hover_bg": "#123326",
  "filter_reset_hover_fg": "#ffffff",
  "filter_reset_hover_border": "#34d399",
  "sort_dir_btn_bg": "#0a1e16",
  "sort_dir_btn_fg": "#34d399",
  "sort_dir_btn_hover_bg": "#123326",
  "sort_dir_btn_hover_border": "#10b981",
  "popup_bg": "#05130d",
  "popup_border": "#1a4d3a",
  "popup_title_fg": "#34d399",
  "popup_btn_bg": "#071711",
  "popup_btn_fg": "#ecfdf5",
  "popup_btn_border": "#1a4d3a",
  "popup_btn_hover_bg": "#123326",
  "popup_btn_hover_border": "#34d399",
  "popup_btn_hover_fg": "#ffffff",
  "popup_sep": "#13382a",
  "popup_list_bg": "#040e0a",
  "popup_list_border": "#13382a",
  "popup_list_hover": "#0e261d",
  "bg_toolbar": "#030a07",
  "toolbar_border": "#13382a",
  "toolbar_btn_bg": "#0a1e16",
  "toolbar_btn_fg": "#ecfdf5",
  "toolbar_btn_border": "#1a4d3a",
  "toolbar_btn_hover_bg": "#123326",
  "toolbar_btn_hover_border": "#34d399",
  "toolbar_btn_hover_fg": "#ffffff",
  "toolbar_btn_pressed": "#07150f",
  "toolbar_primary_bg": "#009473",
  "toolbar_primary_fg": "#ffffff",
  "toolbar_primary_border": "#057a60",
  "toolbar_primary_hover_bg": "#046c55",
  "toolbar_primary_hover_fg": "#ffffff",
  "menu_bg": "#05130d",
  "menu_fg": "#ecfdf5",
  "menu_border": "#1a4d3a",
  "menu_item_fg": "#ecfdf5",
  "menu_item_sel_bg": "#174332",
  "menu_item_sel_fg": "#6ee7b7",
  "menu_item_disabled": "#37594a",
  "menu_separator": "#13382a",
  "border_subtle": "#13382a",
  "border_strong": "#1f5943",
  "border_focus": "#34d399",
  "border_disabled": "#0f291f",
  "card_border": "#13382a",
  "hero_card_top": "#009473",
  "text_primary": "#ecfdf5",
  "text_heading": "#ffffff",
  "text_secondary": "#a7f3d0",
  "text_muted": "#6ee7b7",
  "text_faint": "#43735e",
  "text_disabled": "#37594a",
  "text_checkbox": "#ecfdf5",
  "text_clock_exercise": "#ecfdf5",
  "text_clock_break": "#6ee7b7",
  "tab_text": "#6ee7b7",
  "tab_text_selected": "#34d399",
  "hero_start_bg": "#009473",
  "hero_start_fg": "#ffffff",
  "hero_start_border": "#057a60",
  "hero_start_hover_bg": "#046c55",
  "hero_start_hover_border": "#34d399",
  "hero_start_hover_fg": "#ffffff",
  "hero_pause_bg": "#451a03",
  "hero_pause_fg": "#fde68a",
  "hero_pause_border": "#78350f",
  "hero_pause_hover_bg": "#78350f",
  "hero_pause_hover_border": "#b45309",
  "hero_resume_bg": "#064e3b",
  "hero_resume_fg": "#a7f3d0",
  "hero_resume_border": "#059669",
  "hero_resume_hover_bg": "#047857",
  "hero_resume_hover_border": "#34d399",
  "stop_bg": "#450a0a",
  "stop_fg": "#fca5a5",
  "stop_border": "#7f1d1d",
  "stop_hover_bg": "#7f1d1d",
  "stop_hover_border": "#991b1b",
  "complete_bg": "#009473",
  "complete_fg": "#ffffff",
  "complete_border": "#057a60",
  "complete_hover_bg": "#046c55",
  "danger_bg": "#450a0a",
  "danger_fg": "#fca5a5",
  "danger_border": "#7f1d1d",
  "danger_hover_bg": "#5c1010",
  "comment_action_bg": "#0a1e16",
  "comment_action_fg": "#ecfdf5",
  "comment_action_border": "#1a4d3a",
  "comment_action_hover_bg": "#123326",
  "comment_action_hover_border": "#34d399",
  "comment_action_hover_fg": "#ffffff",
  "badge_completed_bg": "#064e3b",
  "badge_completed_fg": "#6ee7b7",
  "badge_completed_border": "#059669",
  "badge_incomplete_bg": "#450a0a",
  "badge_incomplete_fg": "#fca5a5",
  "badge_incomplete_border": "#7f1d1d",
  "progress_bg": "#071711",
  "progress_border": "#13382a",
  "progress_fg": "#ecfdf5",
  "progress_chunk": "#009473",
  "scroll_bg": "#040e0a",
  "scroll_handle": "#1a4d3a",
  "scroll_handle_hover": "#009473",
  "tooltip_bg": "#0a1e16",
  "tooltip_fg": "#ecfdf5",
  "tooltip_border": "#34d399",
  "color_absence": "#0b2017",
  "color_absence_border": "#183b2c",
  "color_future": "#05120c",
  "color_future_border": "#183b2c",
  "bg_chart": "#06140e",
  "chart_gridline": "#112b20",
  "chart_time_curve": "#059669",
  "chart_time_area": "rgba(5, 150, 105, 0.18)",
  "activity_bar_bg": "#0b2017",
  "activity_bar_fill": "#059669",
  "activity_bar_peak": "#10b981",
  "activity_needle": "#10b981",
  "tab_icon_active": "#10b981",
  "tab_icon_inactive": "#5d8070",
  "clock_card_active_exercise_bg": "#052216",
  "clock_card_active_exercise_border": "#10b981",
  "clock_card_active_break_bg": "#221504",
  "clock_card_active_break_border": "#f59e0b",
  "clock_card_paused_border": "#25543f"
}