{
  "$schema": "./theme.schema.json",
  "name": "halloween",
  "is_dark": true,
  "effect": "halloween",
  "mode_comment": "/* --- TEMA HALLOWEEN [DINÁMICO] (CALABAZA DE OTOÑO & NOCHE ESPECTRAL) --- */",
  "bg_app": "#0c0907",
  "bg_dialog": "#1b130e",
  "bg_surface": "#160f0b",
  "bg_surface_alt": "#211610",
  "bg_card": "#160f0b",
  "bg_card_inner": "#241811",
  "bg_clock_card": "#241811",
  "bg_tab_bar": "#080604",
  "bg_tab_active": "#160f0b",
  "bg_location_badge": "#211610",
  "bg_status_badge": "#1b130e",
  "bg_input": "#0c0907",
  "bg_input_focus": "#241811",
  "bg_input_disabled": "#160f0b",
  "bg_button": "#1b130e",
  "bg_button_hover": "#291d15",
  "bg_button_pressed": "#120c08",
  "bg_stepper_pressed": "#241811",
  "bg_secondary_action": "#1b130e",
  "bg_secondary_hover": "#291d15",
  "bg_table": "#0e0a07",
  "bg_table_alt": "#160f0b",
  "bg_table_header": "#080604",
  "table_gridline": "#2a1c13",
  "table_selection_bg": "#332116",
  "table_selection_fg": "#ffedd5",
  "bg_list": "#0c0907",
  "list_item_hover": "#211610",
  "list_item_selected_bg": "#332116",
  "list_item_selected_fg": "#f97316",
  "bg_filter_panel": "#0e0a07",
  "bg_combobox": "#160f0b",
  "combobox_fg": "#ffedd5",
  "combobox_hover_bg": "#241811",
  "combobox_focus_border": "#f97316",
  "combobox_dropdown_bg": "#0e0a07",
  "combobox_dropdown_fg": "#fff7ed",
  "combobox_dropdown_sel_bg": "#332116",
  "combobox_dropdown_sel_fg": "#fb923c",
  "filter_reset_bg": "#1b130e",
  "filter_reset_fg": "#fb923c",
  "filter_reset_hover_bg": "#291d15",
  "filter_reset_hover_fg": "#ffffff",
  "filter_reset_hover_border": "#f97316",
  "sort_dir_btn_bg": "#1b130e",
  "sort_dir_btn_fg": "#fb923c",
  "sort_dir_btn_hover_bg": "#291d15",
  "sort_dir_btn_hover_border": "#f97316",
  "popup_bg": "#0e0a07",
  "popup_border": "#3d2719",
  "popup_title_fg": "#fb923c",
  "popup_btn_bg": "#160f0b",
  "popup_btn_fg": "#ffedd5",
  "popup_btn_border": "#3d2719",
  "popup_btn_hover_bg": "#241811",
  "popup_btn_hover_border": "#f97316",
  "popup_btn_hover_fg": "#ffffff",
  "popup_sep": "#2a1c13",
  "popup_list_bg": "#0c0907",
  "popup_list_border": "#2a1c13",
  "popup_list_hover": "#211610",
  "bg_toolbar": "#0e0a07",
  "toolbar_border": "#2a1c13",
  "toolbar_btn_bg": "#1b130e",
  "toolbar_btn_fg": "#ffedd5",
  "toolbar_btn_border": "#3d2719",
  "toolbar_btn_hover_bg": "#291d15",
  "toolbar_btn_hover_border": "#f97316",
  "toolbar_btn_hover_fg": "#ffffff",
  "toolbar_btn_pressed": "#120c08",
  "toolbar_primary_bg": "#ea580c",
  "toolbar_primary_fg": "#ffffff",
  "toolbar_primary_border": "#c2410c",
  "toolbar_primary_hover_bg": "#c2410c",
  "toolbar_primary_hover_fg": "#ffffff",
  "menu_bg": "#0e0a07",
  "menu_fg": "#ffedd5",
  "menu_border": "#3d2719",
  "menu_item_fg": "#ffedd5",
  "menu_item_sel_bg": "#332116",
  "menu_item_sel_fg": "#fb923c",
  "menu_item_disabled": "#634735",
  "menu_separator": "#2a1c13",
  "border_subtle": "#2a1c13",
  "border_strong": "#472e1f",
  "border_focus": "#f97316",
  "border_disabled": "#1b130e",
  "card_border": "#2a1c13",
  "hero_card_top": "#f97316",
  "text_primary": "#ffedd5",
  "text_heading": "#ffffff",
  "text_secondary": "#fdba74",
  "text_muted": "#ea580c",
  "text_faint": "#825338",
  "text_disabled": "#634735",
  "text_checkbox": "#ffedd5",
  "text_clock_exercise": "#ffedd5",
  "text_clock_break": "#ea580c",
  "tab_text": "#ea580c",
  "tab_text_selected": "#fb923c",
  "hero_start_bg": "#ea580c",
  "hero_start_fg": "#ffffff",
  "hero_start_border": "#f97316",
  "hero_start_hover_bg": "#c2410c",
  "hero_start_hover_border": "#ea580c",
  "hero_start_hover_fg": "#ffffff",
  "hero_pause_bg": "#451a03",
  "hero_pause_fg": "#fde68a",
  "hero_pause_border": "#78350f",
  "hero_pause_hover_bg": "#78350f",
  "hero_pause_hover_border": "#b45309",
  "hero_resume_bg": "#431407",
  "hero_resume_fg": "#fed7aa",
  "hero_resume_border": "#ea580c",
  "hero_resume_hover_bg": "#7c2d12",
  "hero_resume_hover_border": "#f97316",
  "stop_bg": "#450a0a",
  "stop_fg": "#fca5a5",
  "stop_border": "#7f1d1d",
  "stop_hover_bg": "#7f1d1d",
  "stop_hover_border": "#991b1b",
  "complete_bg": "#065f46",
  "complete_fg": "#a7f3d0",
  "complete_border": "#059669",
  "complete_hover_bg": "#047857",
  "danger_bg": "#450a0a",
  "danger_fg": "#fca5a5",
  "danger_border": "#7f1d1d",
  "danger_hover_bg": "#5c1010",
  "comment_action_bg": "#1b130e",
  "comment_action_fg": "#ffedd5",
  "comment_action_border": "#3d2719",
  "comment_action_hover_bg": "#291d15",
  "comment_action_hover_border": "#f97316",
  "comment_action_hover_fg": "#ffffff",
  "badge_completed_bg": "#132b21",
  "badge_completed_fg": "#34d399",
  "badge_completed_border": "#059669",
  "badge_incomplete_bg": "#450a0a",
  "badge_incomplete_fg": "#fca5a5",
  "badge_incomplete_border": "#7f1d1d",
  "progress_bg": "#160f0b",
  "progress_border": "#2a1c13",
  "progress_fg": "#ffedd5",
  "progress_chunk": "#f97316",
  "scroll_bg": "#0c0907",
  "scroll_handle": "#3d2719",
  "scroll_handle_hover": "#f97316",
  "tooltip_bg": "#1b130e",
  "tooltip_fg": "#ffedd5",
  "tooltip_border": "#f97316",
  "color_absence": "#26160c",
  "color_absence_border": "#4a2810",
  "color_future": "#0f0b08",
  "color_future_border": "#4a2810",
  "bg_chart": "#140c07",
  "chart_gridline": "#2b160b",
  "chart_time_curve": "#ea580c",
  "chart_time_area": "rgba(234, 88, 12, 0.18)",
  "activity_bar_bg": "#26160c",
  "activity_bar_fill": "#ea580c",
  "activity_bar_peak": "#f97316",
  "activity_needle": "#f97316",
  "tab_icon_active": "#f97316",
  "tab_icon_inactive": "#9c6848",
  "clock_card_active_exercise_bg": "#2a1405",
  "clock_card_active_exercise_border": "#ea580c",
  "clock_card_active_break_bg": "#2b1028",
  "clock_card_active_break_border": "#a855f7",
  "clock_card_paused_border": "#663818"
}