{
  "$schema": "./theme.schema.json",
  "name": "spring",
  "is_dark": false,
  "effect": "leaves",
  "mode_comment": "/* --- TEMA SPRING [DINÁMICO] (PRADERA DE PRIMAVERA & BROTES VERDES) --- */",
  "bg_app": "#eff5ec",
  "bg_dialog": "#f6faf3",
  "bg_surface": "#f6faf3",
  "bg_surface_alt": "#e2eedd",
  "bg_card": "#f6faf3",
  "bg_card_inner": "#e2eedd",
  "bg_clock_card": "#f6faf3",
  "bg_tab_bar": "#d5e5cf",
  "bg_tab_active": "#f6faf3",
  "bg_location_badge": "#e2eedd",
  "bg_status_badge": "#d5e5cf",
  "bg_input": "#f6faf3",
  "bg_input_focus": "#ffffff",
  "bg_input_disabled": "#d5e5cf",
  "bg_button": "#f6faf3",
  "bg_button_hover": "#e2eedd",
  "bg_button_pressed": "#c9dfc3",
  "bg_stepper_pressed": "#c9dfc3",
  "bg_secondary_action": "#f6faf3",
  "bg_secondary_hover": "#e2eedd",
  "bg_table": "#f6faf3",
  "bg_table_alt": "#f0f6ed",
  "bg_table_header": "#d5e5cf",
  "table_gridline": "#cadbc3",
  "table_selection_bg": "#dbe9d4",
  "table_selection_fg": "#16381e",
  "bg_list": "#f6faf3",
  "list_item_hover": "#e2eedd",
  "list_item_selected_bg": "#dbe9d4",
  "list_item_selected_fg": "#15803d",
  "bg_filter_panel": "#eff5ec",
  "bg_combobox": "#f6faf3",
  "combobox_fg": "#16381e",
  "combobox_hover_bg": "#e2eedd",
  "combobox_focus_border": "#16a34a",
  "combobox_dropdown_bg": "#f6faf3",
  "combobox_dropdown_fg": "#16381e",
  "combobox_dropdown_sel_bg": "#dbe9d4",
  "combobox_dropdown_sel_fg": "#15803d",
  "filter_reset_bg": "#d5e5cf",
  "filter_reset_fg": "#3f6212",
  "filter_reset_hover_bg": "#c9dfc3",
  "filter_reset_hover_fg": "#16381e",
  "filter_reset_hover_border": "#65a30d",
  "sort_dir_btn_bg": "#d5e5cf",
  "sort_dir_btn_fg": "#15803d",
  "sort_dir_btn_hover_bg": "#c9dfc3",
  "sort_dir_btn_hover_border": "#16a34a",
  "popup_bg": "#f6faf3",
  "popup_border": "#cadbc3",
  "popup_title_fg": "#15803d",
  "popup_btn_bg": "#eff5ec",
  "popup_btn_fg": "#2d4a34",
  "popup_btn_border": "#cadbc3",
  "popup_btn_hover_bg": "#e2eedd",
  "popup_btn_hover_border": "#16a34a",
  "popup_btn_hover_fg": "#16381e",
  "popup_sep": "#cadbc3",
  "popup_list_bg": "#f6faf3",
  "popup_list_border": "#cadbc3",
  "popup_list_hover": "#e2eedd",
  "bg_toolbar": "#f6faf3",
  "toolbar_border": "#cadbc3",
  "toolbar_btn_bg": "#f6faf3",
  "toolbar_btn_fg": "#16381e",
  "toolbar_btn_border": "#cadbc3",
  "toolbar_btn_hover_bg": "#e2eedd",
  "toolbar_btn_hover_border": "#16a34a",
  "toolbar_btn_hover_fg": "#16381e",
  "toolbar_btn_pressed": "#c9dfc3",
  "toolbar_primary_bg": "#16a34a",
  "toolbar_primary_fg": "#ffffff",
  "toolbar_primary_border": "#15803d",
  "toolbar_primary_hover_bg": "#15803d",
  "toolbar_primary_hover_fg": "#ffffff",
  "menu_bg": "#f6faf3",
  "menu_fg": "#16381e",
  "menu_border": "#cadbc3",
  "menu_item_fg": "#16381e",
  "menu_item_sel_bg": "#dbe9d4",
  "menu_item_sel_fg": "#15803d",
  "menu_item_disabled": "#94a398",
  "menu_separator": "#cadbc3",
  "border_subtle": "#cadbc3",
  "border_strong": "#b1c8a8",
  "border_focus": "#16a34a",
  "border_disabled": "#cadbc3",
  "card_border": "#cadbc3",
  "hero_card_top": "#16a34a",
  "text_primary": "#16381e",
  "text_heading": "#0d2413",
  "text_secondary": "#2d4a34",
  "text_muted": "#52735a",
  "text_faint": "#94a398",
  "text_disabled": "#94a398",
  "text_checkbox": "#16381e",
  "text_clock_exercise": "#16381e",
  "text_clock_break": "#52735a",
  "tab_text": "#52735a",
  "tab_text_selected": "#15803d",
  "hero_start_bg": "#16a34a",
  "hero_start_fg": "#ffffff",
  "hero_start_border": "#15803d",
  "hero_start_hover_bg": "#15803d",
  "hero_start_hover_border": "#166534",
  "hero_start_hover_fg": "#ffffff",
  "hero_pause_bg": "#fef3c7",
  "hero_pause_fg": "#b45309",
  "hero_pause_border": "#fde68a",
  "hero_pause_hover_bg": "#fde68a",
  "hero_pause_hover_border": "#d97706",
  "hero_resume_bg": "#dbe9d4",
  "hero_resume_fg": "#15803d",
  "hero_resume_border": "#bbf7d0",
  "hero_resume_hover_bg": "#bbf7d0",
  "hero_resume_hover_border": "#16a34a",
  "stop_bg": "#fee2e2",
  "stop_fg": "#dc2626",
  "stop_border": "#fca5a5",
  "stop_hover_bg": "#fca5a5",
  "stop_hover_border": "#b91c1c",
  "complete_bg": "#16a34a",
  "complete_fg": "#ffffff",
  "complete_border": "#15803d",
  "complete_hover_bg": "#15803d",
  "danger_bg": "#fee2e2",
  "danger_fg": "#dc2626",
  "danger_border": "#fca5a5",
  "danger_hover_bg": "#fca5a5",
  "comment_action_bg": "#f6faf3",
  "comment_action_fg": "#2d4a34",
  "comment_action_border": "#cadbc3",
  "comment_action_hover_bg": "#e2eedd",
  "comment_action_hover_border": "#16a34a",
  "comment_action_hover_fg": "#16381e",
  "badge_completed_bg": "#dcfce7",
  "badge_completed_fg": "#15803d",
  "badge_completed_border": "#86efac",
  "badge_incomplete_bg": "#fee2e2",
  "badge_incomplete_fg": "#dc2626",
  "badge_incomplete_border": "#fca5a5",
  "progress_bg": "#d5e5cf",
  "progress_border": "#cadbc3",
  "progress_fg": "#16381e",
  "progress_chunk": "#16a34a",
  "scroll_bg": "#eff5ec",
  "scroll_handle": "#b1c8a8",
  "scroll_handle_hover": "#16a34a",
  "tooltip_bg": "#16381e",
  "tooltip_fg": "#f6faf3",
  "tooltip_border": "#2d4a34",
  "color_absence": "#e1ebd9",
  "color_absence_border": "#cad9c0",
  "color_future": "#ebf3e6",
  "color_future_border": "#cad9c0",
  "bg_chart": "#f8fcf6",
  "chart_gridline": "#dbe6d3",
  "chart_time_curve": "#15803d",
  "chart_time_area": "rgba(21, 128, 61, 0.14)",
  "activity_bar_bg": "#e1ebd9",
  "activity_bar_fill": "#22c55e",
  "activity_bar_peak": "#15803d",
  "activity_needle": "#15803d",
  "tab_icon_active": "#15803d",
  "tab_icon_inactive": "#6d8263",
  "clock_card_active_exercise_bg": "#eef8eb",
  "clock_card_active_exercise_border": "#15803d",
  "clock_card_active_break_bg": "#fcf5df",
  "clock_card_active_break_border": "#d97706",
  "clock_card_paused_border": "#c5d7bc"
}