{
  "$schema": "./theme.schema.json",
  "name": "bamboo",
  "is_dark": false,
  "effect": "bamboo",
  "mode_comment": "/* --- TEMA BAMBOO [DINÁMICO] (BOSQUE ZEN & CAÑA DE BAMBÚ) --- */",
  "bg_app": "#f3ede1",
  "bg_dialog": "#f9f5ed",
  "bg_surface": "#f9f5ed",
  "bg_surface_alt": "#e9dfcc",
  "bg_card": "#f9f5ed",
  "bg_card_inner": "#e9dfcc",
  "bg_clock_card": "#f9f5ed",
  "bg_tab_bar": "#e0d3bd",
  "bg_tab_active": "#f9f5ed",
  "bg_location_badge": "#e9dfcc",
  "bg_status_badge": "#e0d3bd",
  "bg_input": "#f9f5ed",
  "bg_input_focus": "#ffffff",
  "bg_input_disabled": "#e0d3bd",
  "bg_button": "#f9f5ed",
  "bg_button_hover": "#e9dfcc",
  "bg_button_pressed": "#d8caaf",
  "bg_stepper_pressed": "#d8caaf",
  "bg_secondary_action": "#f9f5ed",
  "bg_secondary_hover": "#e9dfcc",
  "bg_table": "#f9f5ed",
  "bg_table_alt": "#f5efe4",
  "bg_table_header": "#e0d3bd",
  "table_gridline": "#d4c6ae",
  "table_selection_bg": "#e2d8c3",
  "table_selection_fg": "#262016",
  "bg_list": "#f9f5ed",
  "list_item_hover": "#e9dfcc",
  "list_item_selected_bg": "#e2d8c3",
  "list_item_selected_fg": "#3f6212",
  "bg_filter_panel": "#f3ede1",
  "bg_combobox": "#f9f5ed",
  "combobox_fg": "#262016",
  "combobox_hover_bg": "#e9dfcc",
  "combobox_focus_border": "#4d7c0f",
  "combobox_dropdown_bg": "#f9f5ed",
  "combobox_dropdown_fg": "#262016",
  "combobox_dropdown_sel_bg": "#e2d8c3",
  "combobox_dropdown_sel_fg": "#3f6212",
  "filter_reset_bg": "#e0d3bd",
  "filter_reset_fg": "#5c4d3c",
  "filter_reset_hover_bg": "#d8caaf",
  "filter_reset_hover_fg": "#262016",
  "filter_reset_hover_border": "#4d7c0f",
  "sort_dir_btn_bg": "#e0d3bd",
  "sort_dir_btn_fg": "#3f6212",
  "sort_dir_btn_hover_bg": "#d8caaf",
  "sort_dir_btn_hover_border": "#4d7c0f",
  "popup_bg": "#f9f5ed",
  "popup_border": "#d4c6ae",
  "popup_title_fg": "#3f6212",
  "popup_btn_bg": "#f3ede1",
  "popup_btn_fg": "#443628",
  "popup_btn_border": "#d4c6ae",
  "popup_btn_hover_bg": "#e9dfcc",
  "popup_btn_hover_border": "#4d7c0f",
  "popup_btn_hover_fg": "#262016",
  "popup_sep": "#d4c6ae",
  "popup_list_bg": "#f9f5ed",
  "popup_list_border": "#d4c6ae",
  "popup_list_hover": "#e9dfcc",
  "bg_toolbar": "#f9f5ed",
  "toolbar_border": "#d4c6ae",
  "toolbar_btn_bg": "#f9f5ed",
  "toolbar_btn_fg": "#262016",
  "toolbar_btn_border": "#d4c6ae",
  "toolbar_btn_hover_bg": "#e9dfcc",
  "toolbar_btn_hover_border": "#4d7c0f",
  "toolbar_btn_hover_fg": "#262016",
  "toolbar_btn_pressed": "#d8caaf",
  "toolbar_primary_bg": "#4d7c0f",
  "toolbar_primary_fg": "#ffffff",
  "toolbar_primary_border": "#3f6212",
  "toolbar_primary_hover_bg": "#3f6212",
  "toolbar_primary_hover_fg": "#ffffff",
  "menu_bg": "#f9f5ed",
  "menu_fg": "#262016",
  "menu_border": "#d4c6ae",
  "menu_item_fg": "#262016",
  "menu_item_sel_bg": "#e2d8c3",
  "menu_item_sel_fg": "#3f6212",
  "menu_item_disabled": "#9c8f7e",
  "menu_separator": "#d4c6ae",
  "border_subtle": "#d4c6ae",
  "border_strong": "#bdae95",
  "border_focus": "#4d7c0f",
  "border_disabled": "#d4c6ae",
  "card_border": "#d4c6ae",
  "hero_card_top": "#4d7c0f",
  "text_primary": "#262016",
  "text_heading": "#19140d",
  "text_secondary": "#443628",
  "text_muted": "#6e5d48",
  "text_faint": "#9c8f7e",
  "text_disabled": "#9c8f7e",
  "text_checkbox": "#262016",
  "text_clock_exercise": "#262016",
  "text_clock_break": "#6e5d48",
  "tab_text": "#6e5d48",
  "tab_text_selected": "#3f6212",
  "hero_start_bg": "#4d7c0f",
  "hero_start_fg": "#ffffff",
  "hero_start_border": "#3f6212",
  "hero_start_hover_bg": "#3f6212",
  "hero_start_hover_border": "#365314",
  "hero_start_hover_fg": "#ffffff",
  "hero_pause_bg": "#fef3c7",
  "hero_pause_fg": "#b45309",
  "hero_pause_border": "#fde68a",
  "hero_pause_hover_bg": "#fde68a",
  "hero_pause_hover_border": "#d97706",
  "hero_resume_bg": "#ecfccb",
  "hero_resume_fg": "#3f6212",
  "hero_resume_border": "#d9f99d",
  "hero_resume_hover_bg": "#d9f99d",
  "hero_resume_hover_border": "#4d7c0f",
  "stop_bg": "#fee2e2",
  "stop_fg": "#dc2626",
  "stop_border": "#fca5a5",
  "stop_hover_bg": "#fca5a5",
  "stop_hover_border": "#b91c1c",
  "complete_bg": "#4d7c0f",
  "complete_fg": "#ffffff",
  "complete_border": "#3f6212",
  "complete_hover_bg": "#3f6212",
  "danger_bg": "#fee2e2",
  "danger_fg": "#dc2626",
  "danger_border": "#fca5a5",
  "danger_hover_bg": "#fca5a5",
  "comment_action_bg": "#f9f5ed",
  "comment_action_fg": "#443628",
  "comment_action_border": "#d4c6ae",
  "comment_action_hover_bg": "#e9dfcc",
  "comment_action_hover_border": "#4d7c0f",
  "comment_action_hover_fg": "#262016",
  "badge_completed_bg": "#ecfccb",
  "badge_completed_fg": "#3f6212",
  "badge_completed_border": "#bef264",
  "badge_incomplete_bg": "#fee2e2",
  "badge_incomplete_fg": "#dc2626",
  "badge_incomplete_border": "#fca5a5",
  "progress_bg": "#e0d3bd",
  "progress_border": "#d4c6ae",
  "progress_fg": "#262016",
  "progress_chunk": "#4d7c0f",
  "scroll_bg": "#f3ede1",
  "scroll_handle": "#bdae95",
  "scroll_handle_hover": "#4d7c0f",
  "tooltip_bg": "#262016",
  "tooltip_fg": "#f9f5ed",
  "tooltip_border": "#443628",
  "color_absence": "#e6dfd1",
  "color_absence_border": "#d4cbb9",
  "color_future": "#f0eae0",
  "color_future_border": "#d4cbb9",
  "bg_chart": "#fdfbf7",
  "chart_gridline": "#e2dacf",
  "chart_time_curve": "#4d7c0f",
  "chart_time_area": "rgba(77, 124, 15, 0.14)",
  "activity_bar_bg": "#e6dfd1",
  "activity_bar_fill": "#65a30d",
  "activity_bar_peak": "#4d7c0f",
  "activity_needle": "#4d7c0f",
  "tab_icon_active": "#4d7c0f",
  "tab_icon_inactive": "#78705f",
  "clock_card_active_exercise_bg": "#eef4e8",
  "clock_card_active_exercise_border": "#4d7c0f",
  "clock_card_active_break_bg": "#fcf3dd",
  "clock_card_active_break_border": "#d97706",
  "clock_card_paused_border": "#cfc4b0"
}