{
  "$schema": "./theme.schema.json",
  "name": "winter",
  "is_dark": true,
  "effect": "snow",
  "mode_comment": "/* --- TEMA WINTER [DINÁMICO] (ESCARCHA ÁRTICA & AZUL GLACIAR) --- */",
  "bg_app": "#090e17",
  "bg_dialog": "#111c2e",
  "bg_surface": "#0f1827",
  "bg_surface_alt": "#142238",
  "bg_card": "#0f1827",
  "bg_card_inner": "#15243b",
  "bg_clock_card": "#15243b",
  "bg_tab_bar": "#070b12",
  "bg_tab_active": "#0f1827",
  "bg_location_badge": "#142238",
  "bg_status_badge": "#111c2e",
  "bg_input": "#090e17",
  "bg_input_focus": "#15243b",
  "bg_input_disabled": "#0f1827",
  "bg_button": "#111c2e",
  "bg_button_hover": "#192a45",
  "bg_button_pressed": "#0c1524",
  "bg_stepper_pressed": "#15243b",
  "bg_secondary_action": "#111c2e",
  "bg_secondary_hover": "#192a45",
  "bg_table": "#0c1421",
  "bg_table_alt": "#0f1827",
  "bg_table_header": "#070b12",
  "table_gridline": "#17263c",
  "table_selection_bg": "#192e4d",
  "table_selection_fg": "#e0f2fe",
  "bg_list": "#090e17",
  "list_item_hover": "#142238",
  "list_item_selected_bg": "#192e4d",
  "list_item_selected_fg": "#38bdf8",
  "bg_filter_panel": "#0a101b",
  "bg_combobox": "#0f1827",
  "combobox_fg": "#e0f2fe",
  "combobox_hover_bg": "#17263c",
  "combobox_focus_border": "#38bdf8",
  "combobox_dropdown_bg": "#0c1421",
  "combobox_dropdown_fg": "#f0f9ff",
  "combobox_dropdown_sel_bg": "#192e4d",
  "combobox_dropdown_sel_fg": "#38bdf8",
  "filter_reset_bg": "#111c2e",
  "filter_reset_fg": "#93c5fd",
  "filter_reset_hover_bg": "#192a45",
  "filter_reset_hover_fg": "#f0f9ff",
  "filter_reset_hover_border": "#38bdf8",
  "sort_dir_btn_bg": "#111c2e",
  "sort_dir_btn_fg": "#38bdf8",
  "sort_dir_btn_hover_bg": "#192a45",
  "sort_dir_btn_hover_border": "#0ea5e9",
  "popup_bg": "#0c1421",
  "popup_border": "#1d3352",
  "popup_title_fg": "#38bdf8",
  "popup_btn_bg": "#0f1827",
  "popup_btn_fg": "#e0f2fe",
  "popup_btn_border": "#1d3352",
  "popup_btn_hover_bg": "#17263c",
  "popup_btn_hover_border": "#38bdf8",
  "popup_btn_hover_fg": "#ffffff",
  "popup_sep": "#17263c",
  "popup_list_bg": "#090e17",
  "popup_list_border": "#17263c",
  "popup_list_hover": "#142238",
  "bg_toolbar": "#0a101b",
  "toolbar_border": "#17263c",
  "toolbar_btn_bg": "#111c2e",
  "toolbar_btn_fg": "#e0f2fe",
  "toolbar_btn_border": "#1d3352",
  "toolbar_btn_hover_bg": "#192a45",
  "toolbar_btn_hover_border": "#38bdf8",
  "toolbar_btn_hover_fg": "#ffffff",
  "toolbar_btn_pressed": "#0c1524",
  "toolbar_primary_bg": "#0284c7",
  "toolbar_primary_fg": "#f0f9ff",
  "toolbar_primary_border": "#0369a1",
  "toolbar_primary_hover_bg": "#0369a1",
  "toolbar_primary_hover_fg": "#ffffff",
  "menu_bg": "#0c1421",
  "menu_fg": "#e0f2fe",
  "menu_border": "#1d3352",
  "menu_item_fg": "#e0f2fe",
  "menu_item_sel_bg": "#192e4d",
  "menu_item_sel_fg": "#38bdf8",
  "menu_item_disabled": "#475569",
  "menu_separator": "#17263c",
  "border_subtle": "#17263c",
  "border_strong": "#1e3a5f",
  "border_focus": "#38bdf8",
  "border_disabled": "#132033",
  "card_border": "#17263c",
  "hero_card_top": "#38bdf8",
  "text_primary": "#f0f9ff",
  "text_heading": "#ffffff",
  "text_secondary": "#bae6fd",
  "text_muted": "#7dd3fc",
  "text_faint": "#475569",
  "text_disabled": "#475569",
  "text_checkbox": "#f0f9ff",
  "text_clock_exercise": "#f0f9ff",
  "text_clock_break": "#7dd3fc",
  "tab_text": "#7dd3fc",
  "tab_text_selected": "#38bdf8",
  "hero_start_bg": "#0284c7",
  "hero_start_fg": "#f0f9ff",
  "hero_start_border": "#38bdf8",
  "hero_start_hover_bg": "#0369a1",
  "hero_start_hover_border": "#0284c7",
  "hero_start_hover_fg": "#ffffff",
  "hero_pause_bg": "#451a03",
  "hero_pause_fg": "#fde68a",
  "hero_pause_border": "#78350f",
  "hero_pause_hover_bg": "#78350f",
  "hero_pause_hover_border": "#b45309",
  "hero_resume_bg": "#0c4a6e",
  "hero_resume_fg": "#7dd3fc",
  "hero_resume_border": "#0284c7",
  "hero_resume_hover_bg": "#075985",
  "hero_resume_hover_border": "#38bdf8",
  "stop_bg": "#450a0a",
  "stop_fg": "#fca5a5",
  "stop_border": "#7f1d1d",
  "stop_hover_bg": "#7f1d1d",
  "stop_hover_border": "#991b1b",
  "complete_bg": "#0e7490",
  "complete_fg": "#a5f3fc",
  "complete_border": "#06b6d4",
  "complete_hover_bg": "#0891b2",
  "danger_bg": "#450a0a",
  "danger_fg": "#fca5a5",
  "danger_border": "#7f1d1d",
  "danger_hover_bg": "#5c1010",
  "comment_action_bg": "#111c2e",
  "comment_action_fg": "#e0f2fe",
  "comment_action_border": "#1d3352",
  "comment_action_hover_bg": "#192a45",
  "comment_action_hover_border": "#38bdf8",
  "comment_action_hover_fg": "#ffffff",
  "badge_completed_bg": "#083344",
  "badge_completed_fg": "#38bdf8",
  "badge_completed_border": "#0e7490",
  "badge_incomplete_bg": "#450a0a",
  "badge_incomplete_fg": "#fca5a5",
  "badge_incomplete_border": "#7f1d1d",
  "progress_bg": "#0f1827",
  "progress_border": "#17263c",
  "progress_fg": "#f0f9ff",
  "progress_chunk": "#38bdf8",
  "scroll_bg": "#090e17",
  "scroll_handle": "#1d3352",
  "scroll_handle_hover": "#38bdf8",
  "tooltip_bg": "#111c2e",
  "tooltip_fg": "#f0f9ff",
  "tooltip_border": "#38bdf8",
  "color_absence": "#131e2e",
  "color_absence_border": "#25354e",
  "color_future": "#0a101b",
  "color_future_border": "#25354e",
  "bg_chart": "#0c121e",
  "chart_gridline": "#19263a",
  "chart_time_curve": "#38bdf8",
  "chart_time_area": "rgba(56, 189, 248, 0.15)",
  "activity_bar_bg": "#131e2e",
  "activity_bar_fill": "#38bdf8",
  "activity_bar_peak": "#7dd3fc",
  "activity_needle": "#38bdf8",
  "tab_icon_active": "#38bdf8",
  "tab_icon_inactive": "#6e809c",
  "clock_card_active_exercise_bg": "#091c28",
  "clock_card_active_exercise_border": "#38bdf8",
  "clock_card_active_break_bg": "#241706",
  "clock_card_active_break_border": "#f59e0b",
  "clock_card_paused_border": "#3b4e6d"
}